state,year,name,topic,subtopic,title,relevant_text,description
Alabama,2019,Ala. Code 41-23-212,Definition - Broadband,Speed 3,Definitions,(4) MINIMUM SERVICE THRESHOLD. A connection to the Internet that provides capacity for transmission at an average speed per customer of at least 25 megabits (25 Mbps) per second downstream and at least three megabits (3 Mbps) per second upstream.,Defines the minimum speed for a broadband connection as 25 megabits per second (Mbps) download and 3 Mbps upload.
Alabama,2019,Ala. Code 41-23-212,Definition - Unserved,,Definitions,"(6) UNSERVED AREA. Any rural area in which there is not at least one provider of terrestrial broadband service that is either: (1) offering a connection to the Internet meeting the minimum service threshold; or (2) is required, under the terms of the Federal Universal Service Fund or other federal or state grant, to provide a connection to the Internet at speeds meeting the minimum service threshold by March 28, 2023.","Defines “unserved” as any rural area without at least one broadband provider that either offers—or is required by a state or federal grant to provide by March 28, 2023—an internet connection that meets the minimum service threshold. "
Alabama,2019,Ala. Code 41-23-213,Fund - Broadband,,Grant program; rulemaking authority; Alabama Broadband Accessibility Fund.,"(a) The Director of ADECA may establish and administer the broadband accessibility grant program for the purpose of promoting the deployment and adoption of broadband Internet access services to unserved areas. By June 26, 2018, the director shall adopt rules and policies to administer the program and begin to accept applications for grants, and shall adopt such rules as may be necessary to meet the future needs of the grant program.&para;(b) The program shall be administered pursuant to policies developed by ADECA in compliance with this article. The policies shall provide for the awarding of grants to non-governmental entities that are cooperatives, corporations, limited liability companies, partnerships, or other private business entities that provide broadband services. Nothing in this article shall expand the authority under state law of any entity to provide broadband service.&para;(c) There is hereby created the Alabama Broadband Accessibility Fund in the State Treasury. The fund is subject to appropriations by the Legislature and gifts, grants, and other donations received by ADECA for the broadband accessibility grant program or fund. ADECA may not spend appropriations for the program for purposes other than those listed in this section. Any monies appropriated to ADECA for broadband grants that are unspent at the end of a fiscal year shall be carried over for use by the program in the next fiscal year. ADECA shall develop rules ensuring that expenses incurred to administer the program must not exceed the lesser of seven percent of the total amount appropriated for the program in any fiscal year or seven hundred fifty thousand dollars ($750,000). Moneys in the fund shall be invested by the State Treasurer for the sole benefit of the fund.&para;(d)(1) Individual grants awarded by ADECA under this section may only be awarded for projects in unserved areas, and may not exceed the lesser of:&para;a. Thirty-five percent of the project costs.&para;b. One million five hundred thousand dollars ($1,500,000) for projects that will be capable of transmitting broadband signals at or above the minimum service threshold.","Creates within the state Treasury the Alabama Broadband Accessibility Fund, administered by the Alabama Department of Economic and Community Affairs, to promote broadband deployment and adoption in unserved areas. The fund is supported through appropriations from the Legislature and from gifts, grants, or other donations. Individual grants awarded cannot exceed 35% of the total project costs, or $1,500,000, whichever is less. "
Alabama,2019,Ala. Code 41-23-214,Task Force,,Alabama Rural Broadband Oversight Committee.,"(a) There is created the Alabama Rural Broadband Oversight Committee. The committee shall consist of the Chair of the House Ways and Means Education Committee or his or her designee, the Chair of the Senate Finance and Taxation Education Committee or his or her designee, two members appointed by the Speaker of the House of Representatives, two members appointed by the President Pro Tempore of the Senate, and the Director of ADECA or his or her designee. The committee shall meet at least annually, provide general oversight of the implementation of the article, and recommend further statutory changes to promote rural broadband development.&para;(b) The committee shall reflect the racial, gender, geographic, urban/rural, and economic diversity of the state.&para;(c) For any year in which grants are distributed under the program, ADECA shall produce a report on the status of grants under the program to the committee, including progress toward increased access to and adoption of broadband services. The report shall be provided at the committee’s first meeting of the year and be published on ADECA's website. ADECA shall provide a copy of the report to the Governor, the Alabama Senate President Pro Tempore, the Alabama Senate Minority Leader, the Speaker of the Alabama House of Representatives, and the Alabama House of Representatives Minority Leader. By March 28, 2019, ADECA shall produce a report on the availability of broadband within the state.",Creates the Alabama Rural Broadband Oversight Committee to provide general oversight of and recommend statutory changes that promote rural broadband deployment.
Alabama,2000,Ala. Code 11-50B-1,Legislative Intent,,Purpose,"It is hereby declared to be the public policy of this state to encourage the development of advanced telecommunications capabilities, cable, interactive computer, and Internet facilities and services to better serve the public and further industrial economic development in this state. It is necessary for growth, job opportunities, and sustained economic development to encourage new investment in advanced telecommunications capabilities, cable, interactive computer, and Internet facilities, including investment by public providers of these services. Nothing contained herein, however, is intended to exempt, except, or exclude public providers which engage in the provision of advanced telecommunications capability or services, cable, interactive computer, or Internet facilities or services pursuant to the authority granted herein from complying with any provisions of federal law which may at any time apply to the public providers or their facilities or services, including without limitation, to the extent that they apply, any requirement that they interconnect with other telecommunications providers, or that they obtain from the regulatory authorities designated by federal law as being the appropriate bodies from which to obtain any requisite approval, the approval of interconnection agreements with other telecommunications providers.",Establishes a state policy for encouraging the development of advanced telecommunications capabilities to serve the public and facilitate economic development.
Alabama,2000,Ala. Code 11-50B-1 et seq.,Municipal Broadband,,Purpose,"It is hereby declared to be the public policy of this state to encourage the development of advanced telecommunications capabilities, cable, interactive computer, and Internet facilities and services to better serve the public and further industrial economic development in this state. It is necessary for growth, job opportunities, and sustained economic development to encourage new investment in advanced telecommunications capabilities, cable, interactive computer, and Internet facilities, including investment by public providers of these services. Nothing contained herein, however, is intended to exempt, except, or exclude public providers which engage in the provision of advanced telecommunications capability or services, cable, interactive computer, or Internet facilities or services pursuant to the authority granted herein from complying with any provisions of federal law which may at any time apply to the public providers or their facilities or services, including without limitation, to the extent that they apply, any requirement that they interconnect with other telecommunications providers, or that they obtain from the regulatory authorities designated by federal law as being the appropriate bodies from which to obtain any requisite approval, the approval of interconnection agreements with other telecommunications providers.","Allows public providers to construct and operate internet systems for inhabitants of a municipality or police jurisdiction and any area where the municipality provides utility service. Also allows the lease of municipal systems to private providers. Addresses requirements and limitations of municipal systems, including that capital and operating expenditures cannot be paid with state or local tax revenue or appropriations. "
Alaska,2020,AS 14.03.127,Fund - Broadband,,Funding for Internet services.,"(a) Each fiscal year, a district in which one or more schools qualify for a discounted rate for Internet services under the federal universal services program is eligible to receive an amount for each school that is equal to the amount needed to bring the applicant's share to 10 megabits of download a second of the Internet services.",Declares that school districts with at least one e-rate-eligible school are also eligible for state funding to ensure that they can receive download speeds of at least 10 megabits per second (Mbps).
Arizona,2020,Ariz. Rev. Stat. 10-2051,Definition - Broadband,Speed 3,Definitions,"2. ""Broadband service"" means providing access and transport to the internet, computer processing, information storage or protocol conversion at a download rate of at least twenty-five megabits per second and at an upload rate of at least three megabits per second.",Defines “broadband service” as internet access with a download rate of at least 25 megabits per second (Mbps) and an upload rate of at least 3 Mbps.
Arizona,2020,Ariz. Rev. Stat. 10-2052,Cooperatives,Electric,Purpose,"A. Cooperative nonprofit membership corporations may be organized under this article for any of the following purposes:...5. Directly or through an affiliate, providing broadband service to areas in which the cooperative provides electric energy services.",Authorizes electric cooperatives to provide broadband services in areas where they provide electric services.
Arizona,2020,Ariz. Rev. Stat. 10-2057,Rights-of-way,Easements,Powers of electric cooperative,"A. A cooperative organized under this article may:...17. Directly or through an affiliate, construct, operate, maintain, lease and license fiber optic cables and other facilities to provide broadband service over, under, across, on or along real property, personal property, rights-of-way, easements and licenses and other property rights that are owned, held or used by the cooperative, including easement or other property rights owned, held or used by the cooperative to provide electricity or other services.",Grants electric cooperatives the right to obtain easements to provide electric and broadband services.
Arizona,2020,Ariz. Rev. Stat. 10-2085,Other,,Expanded use for broadband; just compensation; notice,"A. For the purposes of providing broadband service, if a cooperative, directly or through its affiliate, expands the use of an existing easement or other property right that is owned, held or used by the cooperative to provide electricity or other services and the expanded use reduces the fair market value of the property over which the easement or other property right runs, the property owner is entitled to just compensation from the cooperative.",Requires cooperatives to fairly compensate owners whose real property loses market value as a result of broadband infrastructure deployment through that property.
Arizona,2020,Ariz. Rev. Stat. 10-2121,Definition - Broadband,Speed 3,Definitions,"2. ""Broadband service"" means providing access and transport to the internet, computer processing, information storage or protocol conversion at a download rate of at least twenty-five megabits per second and at an upload rate of at least three megabits per second.",Defines “broadband service” as internet access with a download rate of at least 25 megabits per second (Mbps) and an upload rate of at least 3 Mbps.
Arizona,2020,Ariz. Rev. Stat. 10-2122,Cooperatives,Electric,Purpose,"Nonprofit electric generation and transmission cooperative corporations may be organized under this article for the purpose of:...3. Directly or through an affiliate, providing broadband service to areas in which the cooperative provides electric energy services.",Authorizes electric generation and transmission cooperatives to provide broadband services in areas where they provide electric services.
Arizona,2020,Ariz. Rev. Stat. 10-2127,Rights-of-way,Easements,Powers of a generation and transmission cooperative,"A. A generation and transmission cooperative may:...17. Directly or through an affiliate, construct, operate, maintain, lease and license fiber optic cables and other facilities to provide broadband service over, under, across, on or along real property, personal property, rights-of-way, easements and licenses and other property rights that are owned, held or used by the cooperative, including easement or other property rights owned, held or used by the cooperative to provide electricity or other services.",Grants electric generation and transmission cooperatives the right to obtain easements to provide electric and broadband service.
Arizona,2020,Ariz. Rev. Stat. 10-2151,Other,,Expanded use for broadband; just compensation; notice,"A. For the purposes of providing broadband service, if a generation and transmission cooperative, directly or through its affiliate, expands the use of an existing easement or other property right that is owned, held or used by the cooperative to provide electricity or other services and the expanded use reduces the fair market value of the property over which the easement or other property right runs, the property owner is entitled to just compensation from the cooperative.",Requires cooperatives to fairly compensate owners whose real property loses market value as a result of broadband infrastructure deployment through that property.
Arizona,No Date,Ariz. Rev. Stat. 42-14401 et seq.,Other,,Telecommunications Companies,"A. On or before April 1 of each year each telecommunications company, under the oath of its chief officer in this state, shall make and file a statement with the department in a form prescribed by the department and containing:&para;1. The name and nature of the business of the company, whether an individual, association or corporation and under the laws of which state or country it is organized.&para;2. The location of its principal office.&para;3. The names and mailing addresses of its president, secretary, tax agent, auditor, treasurer, superintendent or general manager and the chief officer or managing agent in this state.&para;4. The par value and market value of its shares of stock.&para;5. A detailed schedule of the real property the company owns in this state including its location and valuation.&para;6. The total length of its lines in this state, including lines that are controlled or used under lease or otherwise and the number of miles of lines in each county.&para;7. A complete and correct inventory of all other personal property it owned in this state on the preceding January 1, where the property was located and its value.&para;8. The total gross receipts for the year ending January 1 from all sources and the portion of the receipts that was derived entirely in this state.&para;9. The operating expenses for the year ending January 1, itemized or divided as required by the department.&para;10. The amount that was paid in dividends and the percentage the dividends bear to its capital...A. On or before August 31 of each year, the department shall determine the valuation as of January 1 of the property of all telecommunications companies operating in this state at its full cash value. Real estate shall be valued at market value, and personal property shall be valued on a unitary basis at its cost less depreciation. In addition, the taxpayer may submit documentation showing the need for, and the department shall consider, an additional adjustment to recognize obsolescence using standard appraisal methods and techniques.",Outlines annual statement and property valuation requirements for telecommunications companies operating in the state.
Arkansas,2020,Ark. Act 139,Legislative Intent,,Legislative findings and intent,"(a) The General Assembly finds that: (1) Generally, local entities do not budget for or have funds available for broadband due-diligence business studies in connection with 8 making application for federal grants or loans for broadband development programs; (2) In order to spur further development of broadband in rural Arkansas, it is necessary for local entities to conduct due-diligence business studies before application for federal grants or loans for broadband development programs; (3) Expenses associated with broadband due-diligence business studies can be burdensome to rural Arkansas communities, and it is in the best interest of all Arkansans to make this investment; (4) Under current Arkansas law, only certain eligible 18 telecommunications carriers have benefitted from the Arkansas High Cost Fund, which underwrites broadband deployment; and (5) It is necessary to provide funds to local entities to further wide-spread broadband deployment, particularly in unserved and underserved rural Arkansas, and to determine the feasibility of broadband deployment for local entities that currently do not have federally-defined broadband services and where these broadband due-diligence business studies have not been conducted before. (b) It is the intent of the General Assembly to provide funds to local entities to defray expenses for broadband due-diligence business studies in connection with preparation for federal grant and loan applications for broadband development programs administered by the Federal Communications Commission, the United States Department of Agriculture, or other federal agency to spur federally-defined broadband development in rural Arkansas. The provisions of this section shall be in effect only from July 1, 2020 through June 30, 2021. ","States that the General Assembly finds that local entities do not have budgets to conduct due-diligence studies before applying for federal broadband development grants or loans, and intends to provide municipalities with funds to defray those costs. "
Arkansas,2020,Ark. Code 19-5-1154,Fund - Broadband,,Rural Broadband I.D. Expenses Trust Fund - Creation - Purpose - Definitions,"(a) There is created on the books of the Treasurer of State, the Auditor of State, and the Chief Fiscal Officer of the State, a trust fund to be known as the “Rural Broadband I.D. Expenses Trust Fund”.&para;(b) The Rural Broadband I.D. Expenses Trust Fund shall be used for one-time grants for the defrayment of expenses for broadband due-diligence business studies incurred by prospective federal broadband program applicants, in anticipation of and before application for funding from:",Creates the Rural I.D. Expenses Trust Fund to defray the costs incurred for local due-diligence feasibility studies of prospective federal broadband grant applicants.
Arkansas,2020,Ark. Act 139,Agency,,Management of Rural Broadband I.D. Expenses Trust Fund Grant Application Process,"(a) The Institute for Digital Health and Innovation of the University of Arkansas for Medical Sciences shall manage the Rural Broadband I.D. Expenses Trust Fund grant application process for local entities. (b) The Institute for Digital Health and Innovation shall: (1) Determine Rural Broadband I.D. Expenses Trust Fund grantees; (2) Promulgate rules necessary to implement this act; (3)(A) Determine the amount of the Rural Broadband I.D. Expenses Trust Fund grant funds disbursed to an applicant. (B) An applicant may be a prospective and qualified applicant for a federal grant or loan for a broadband development program under the federal regulations promulgated by the Federal Communications Commission, the United States Department of Agriculture, or other federal agency; (4) Make the determination if the grants shall be awarded; and (5) Inform the Treasurer of State when a determination is made for the awarding of Rural Broadband I.D. Expenses Trust Fund grants. ",Instructs the University of Arkansas for Medical Sciences’ Institute for Digital Health and Innovation to oversee the management of the Rural I.D. Expenses Trusts Fund grant application process.
California,2019,Calif. EDC Code 17072.35,Fund - Other,Schools and Libraries,New Construction Funding Process,"A grant for new construction may be used for any and all costs necessary to adequately house new pupils in any approved project, and those costs may only include the cost of design, engineering, testing, inspection, plan checking, construction management, site acquisition and development, evaluation and response action costs relating to hazardous substances at a new or existing schoolsite, demolition, construction, acquisition and installation of portable classrooms, landscaping, necessary utility costs, utility connections and other fees, equipment including telecommunication equipment to increase school security, furnishings, and the upgrading of electrical systems or the wiring or cabling of classrooms in order to accommodate educational technology. A grant for new construction may also be used to acquire an existing government or privately owned building, or a privately financed school building, and for the necessary costs of converting the government or privately owned building for public school use. A grant for new construction may also be used for the costs of designs and materials that promote the efficient use of energy and water, the maximum use of natural lighting and indoor air quality, the use of recycled materials and materials that emit a minimum of toxic substances, the use of acoustics conducive to teaching and learning, and other characteristics of high performance schools.",Allows the 2020 State School Facilities Fund to support site-based broadband infrastructure as part of new school construction projects.
California,2019,Calif. EDC Code 17074.25,Fund - Other,Schools and Libraries,Modernization Apportionment,"(a) A modernization apportionment may be used for an improvement to extend the useful life of, or to enhance the physical environment of, the school. The improvement may only include the cost of design, engineering, testing, inspection, plan checking, construction management, demolition, construction, the replacement of portable classrooms, necessary utility costs, utility connection and other fees, the purchase and installation of air-conditioning equipment and insulation materials and related costs, furniture and equipment, including telecommunication equipment to increase school security, fire safety improvements, playground safety improvements, the identification, assessment, or abatement of hazardous asbestos, seismic safety improvements, and the upgrading of electrical systems or the wiring or cabling of classrooms in order to accommodate educational technology. A modernization grant may not be used for costs associated with acquisition and development of real property or for routine maintenance and repair.",Allows the 2020 State School Facilities Fund to support site-based broadband infrastructure as part of school modernization projects.
California,2020,Calif. PUC Code 281,Definition - Unserved,,Advisory Boards,"(B) (i) Except as provided in clause (ii), for purposes of this section, “unserved household” means a household for which no facility-based broadband provider offers broadband service at speeds of at least 6 megabits per second (mbps) downstream and one mbps upstream. ",Defines an “unserved household” as having no facility-based broadband provider that offers service with download speeds of at least 6 megabits per second (Mbps) and upload speeds of 1 Mbps.
California,2020,Calif. PUC Code 281,Goal,,Advisory Boards,"The goal of the program is, no later than December 31, 2022, to approve funding for infrastructure projects that will provide broadband access to no less than 98 percent of California households in each consortia region, as identified by the commission on or before January 1, 2017. The commission shall be responsible for achieving the goals of the program. ","Sets a goal for the California Advanced Services Fund program of supporting infrastructure projects sufficient to provide broadband access to at least 98% of households in each consortia region no later than Dec. 31, 2022; regions must be identified by the Public Utility Commission on or before Jan. 1, 2017. "
