state,year,name,topic,subtopic,title,relevant_text,description
Missouri,2020,Mo. Rev. Stat. 67.1461,Financing - Other,,Powers of district — reimbursement of municipality — limitations.,"1. Each district shall have all the powers, except to the extent any such power has been limited by the petition approved by the governing body of the municipality to establish the district, necessary to carry out and effectuate the purposes and provisions of sections 67.1401 to 67.1571 including, but not limited to, the following: (29) To partner with a telecommunications company or broadband service provider in order to construct or improve telecommunications facilities which shall be wholly owned and operated by the telecommunications company or broadband service provider, as the terms ""telecommunications company"" and ""telecommunications facilities"" are defined in section 386.020 and subject to the provisions of section 392.410, that are in an unserved or underserved area, as defined in section 620.2450. Before any facilities are improved or constructed as a result of this section, the area shall be certified as unserved or underserved by the director of broadband development within the department of economic development;","Authorizes funding for telecommunications and broadband service providers in unserved or underserved areas in Community Improvement Districts, special taxing districts that collect revenue to pay for special public facilities, improvements, or services in the district. "
Nebraska,2012,Neb. Rev. Stat. 86-103.01,Definition - Broadband,Tech,"Advanced telecommunications capability service, defined.","Advanced telecommunications capability service means high-speed, broadband telecommunications capability provided by a local exchange carrier that enables users to originate and receive high-quality voice, data, graphics, and video communications using any technology.","Defines “telecommunications service” as high-speed, broadband telecommunications capability provided by a local exchange carrier that enables users to originate and receive high-quality voice, data, graphics, and video using any technology. "
Nebraska,2011,Neb. Rev. Stat. 86-164,Rights-of-way,Railroad,"Telecommunications carrier; placement of line, wire, or cable across railroad right-of-way; application; petition; hearing; order; standard crossing fee; expenses; agreement.","(1) Any telecommunications carrier that intends to place a line, wire, or cable across a railroad right-of-way shall request permission for such placement from the railroad carrier. The request shall be in the form of a completed crossing application, including engineering specifications. Upon receipt of such application, the railroad carrier and the telecommunications carrier may enter into a binding wire-crossing agreement. If the railroad carrier and the telecommunications carrier are unable to negotiate a binding wire-crossing agreement within sixty days after receipt of the crossing application by the railroad carrier, either party may submit a petition to the commission for a hearing on the disputed terms and conditions of the purported wire-crossing agreement.&para;(2)(a) Unless otherwise agreed to by all parties, the commission shall, after providing proper notice, hold and complete such hearing within sixty days after receipt of the petition. The commission shall issue an order of its decision within thirty days after the hearing. In rendering its decision, the commission shall consider whether the terms and conditions at issue are unreasonable or against the public interest, taking into account safety, engineering, and access requirements of the railroad carrier as such requirements are prescribed by the Federal Railroad Administration and established rail industry standards.&para;(b) Upon issuance of an order by the commission under subdivision (a) of this subsection, the railroad carrier and the telecommunications carrier shall have fifteen days after the date of issuance to file a conforming wire-crossing agreement with the commission. The commission shall have fifteen days after the date of such filing to approve or reject the agreement. If the commission does not issue an approval or rejection of such agreement within the fifteen-day requirement, the agreement shall be deemed approved. The commission may reject a wire-crossing agreement if it finds that the agreement does not conform to the order issued by the commission. If the commission enters such a finding, the parties shall revise the agreement to comply with the commission's order and shall refile the agreement to the commission for further review. If the commission does not approve or reject the revised agreement within fifteen days after the date of refiling, the agreement shall be deemed approved.&para;(3)(a) Except as provided in subsection (4) of this section or as otherwise agreed to by all parties, if a telecommunications carrier places a line, wire, or cable across a railroad right-of-way pursuant to this section, it shall pay the railroad carrier, owner, manager, agent, or representative of the railroad carrier a one-time standard crossing fee of one thousand two hundred fifty dollars for each applicable crossing. In addition to the standard crossing fee, the telecommunications carrier shall reimburse the railroad carrier for any actual flagging expenses associated with the placement of the line, wire, or cable.&para;(b) The standard crossing fee shall be in lieu of any license fee or any other fees or charges to reimburse the railroad carrier for any direct expense incurred as a result of the placement of the line, wire, or cable.&para;(4) If a railroad carrier or telecommunications carrier believes a special circumstance exists for the placement of a line, wire, or cable across a railroad right-of-way, the railroad carrier or telecommunications carrier may petition the commission for additional requirements or for modification of the standard crossing fee in its initial petition to the commission pursuant to subsection (1) of this section. If the petition is filed with the request for additional requirements or modification, the commission shall determine if a special circumstance exists that necessitates additional requirements for such placement or a modification of the standard crossing fee.&para;(5) This section applies to any telecommunications carrier certified by the commission pursuant to section 86-128. This section does not apply to any longitudinal encumbrance or any line, wire, or cable within any public right-of-way and does not change, modify, or supersede any rights or obligations created pursuant to sections 86-701 to 86-707.&para;(6)(a) A wire-crossing agreement between a railroad carrier and a telecommunications carrier that includes a provision, clause, covenant, or agreement contained in, collateral to, or affecting such wire-crossing agreement that purports to indemnify, defend, or hold harmless the railroad carrier from any liability for loss or damage resulting from the negligence or willful and wanton misconduct of the carrier or its agents, employees, or independent contractors who are directly responsible to such carrier or has the effect of indemnifying, defending, or holding harmless such carrier from the negligence or willful and wanton misconduct of the carrier or its agents, employees, or independent contractors who are directly responsible to the carrier is against the public policy of this state and is unenforceable.&para;(b) Nothing in this section shall affect a provision, clause, covenant, or agreement in which the telecommunications carrier indemnifies, defends, or holds harmless a railroad carrier against liability for loss or damage to the extent that the loss or damage results from the negligence or willful and wanton misconduct of the telecommunications carrier or its agents, employees, or independent contractors who are directly responsible to the telecommunications carrier.&para;(7) For purposes of this section:&para;(a) Railroad carrier has the same meaning as in section 75-402; and&para;(b) Telecommunications carrier means a telecommunications common carrier as defined in section 86-118 or a telecommunications contract carrier as defined in section 86-120.","Allows telecommunications carriers to request permission from railroad carriers to place lines, wires, or cables across railroad rights-of-way."
Nebraska,2020,Neb. Rev. Stat. 86-166,Mapping,,"Broadband Data Improvement Program; purpose; commission, powers and duties.","(1) To ensure that the State of Nebraska is accurately represented in federal broadband grant programs, including grants from the federal Universal Service Fund, the Broadband Data Improvement Program is created. The Broadband Data Improvement Program shall be administered by the commission.&para;(2) The purpose of the Broadband Data Improvement Program is to:&para;(a) Complement the granular broadband availability data submitted by service providers to the Federal Communications Commission or the Universal Service Administrative Company;&para;(b) Leverage the Federal Communication Commission's Digital Opportunity Data Collection to improve Nebraska's broadband map; and&para;(c) Encourage Nebraskans to participate in crowdsourcing efforts developed to enhance federal broadband mapping.&para;(3) In administering the Broadband Data Improvement Program, the commission may:&para;(a) Participate in the Federal Communication Commission's Digital Opportunity Data Collection, as such collection existed on January 1, 2020;&para;(b) In the absence of a federal program to crowdsource broadband data, develop a state-based broadband data crowdsource program if it is determined by the commission that doing so would improve Nebraska's broadband map;&para;(c) Develop a statewide outreach plan to promote citizen participation in a state or federal broadband data crowdsource program;&para;(d) Allocate resources to areas of the state where public feedback, crowdsourcing, or other evidence suggests that the federal broadband data may be inaccurate;&para;(e) Prioritize data improvement in rural areas, including those areas within any city of the first class, city of the second class, village, or unincorporated area of a county; and&para;(f) Adhere to any guidelines established by the Federal Communications Commission for states to improve data.&para;(4) The commission may adopt and promulgate rules and regulations to carry out the purposes of this section.","Creates the Broadband Data Improvement Program to be administered by the Public Utilities Commission. Tasks the program with participating in the FCC’s Digital Opportunity Data Collection, developing a state-based broadband data crowdsource program (if the commission determines that doing so would improve Nebraska’s broadband map), and developing a statewide outreach plan to promote citizen participation in the data crowdsource program, with priority on data improvement in rural areas. "
Nebraska,2020,Neb. Rev. Stat. 86-579,Fund - Broadband,,Nebraska Internet Enhancement Fund; created; use; investment; termination.,"The Nebraska Internet Enhancement Fund is created. The fund shall be used to provide financial assistance to install and deliver broadband or other advanced telecommunications infrastructure and service throughout the state. It is the intent of the Legislature that two hundred fifty thousand dollars shall be appropriated to the fund to be used for startup costs and seed money for FY2001-02. The Public Service Commission may receive gifts, contributions, property, and equipment from public and private sources for purposes of the fund. The fund shall consist of money appropriated by the Legislature, any money transferred pursuant to section 86-127, and gifts, grants, or bequests from any source including any other federal, state, public, and private sources. Transfers from the fund to the General Fund may be made at the direction of the Legislature. Any money in the Nebraska Internet Enhancement Fund available for investment shall be invested by the state investment officer pursuant to the Nebraska Capital Expansion Act and the Nebraska State Funds Investment Act. The fund terminates on June 30, 2021, and the State Treasurer shall transfer any unencumbered money in the fund on such date to the Nebraska Telecommunications Universal Service Fund.&para;The State Treasurer shall transfer one hundred thousand dollars from the Nebraska Internet Enhancement Fund to the General Fund on or before July 15, 2003.&para;The State Treasurer shall transfer fifty thousand dollars from the Nebraska Internet Enhancement Fund to the Rural Broadband Task Force Fund on or before July 15, 2018.","Establishes the Nebraska Internet Enhancement Fund to provide financial assistance for installation and delivery of telecommunications infrastructure and service throughout the state until June 30, 2021. After that date, the state treasurer will transfer any remaining money to the Nebraska Telecommunications Universal Service Fund. "
Nebraska,2020,Neb. Rev. Stat. 86-1102,Task Force,,Rural Broadband Task Force; created; members; terms; advisory groups; staff assistance; powers; duties; expenses; meetings; report.,"(1) The Rural Broadband Task Force is hereby created. Task force members shall include the chairperson of the Transportation and Telecommunications Committee of the Legislature and a member of the Legislature selected by the Executive Board of the Legislative Council who shall both serve as nonvoting, ex officio members, a member of the Public Service Commission who shall be selected by the chairperson of such commission, the chairperson of the Nebraska Information Technology Commission or his or her designee who shall act as chairperson of the task force, the Director of Economic Development or his or her designee, the Director of Agriculture or his or her designee, and the following members to be appointed by the Governor: A representative of the agribusiness community, a representative of the Nebraska business community, a representative of the regulated wireline telecommunications industry, a representative of the wireless telecommunications industry, a representative of the public power industry, a representative of health care providers, a representative of Nebraska postsecondary educational institutions, and a representative of rural schools offering kindergarten through grade twelve. The members appointed by the Governor shall serve for a term of two years and may be reappointed.&para;(2) The task force may appoint advisory groups to assist the task force in providing technical expertise and advice on any issue. The advisory groups may be composed of representatives of stakeholder groups which may include, but not necessarily be limited to, representatives from small and large wireline companies, wireless companies, public power districts, electric cooperative corporations, cable television companies, Internet service providers, low-income telecommunications and electric utility customers, health care providers, and representatives of educational sectors. No compensation or expense reimbursement shall be provided to any member of any advisory group appointed by the task force.&para;(3) The Nebraska Information Technology Commission shall provide staff assistance to the task force in consultation with staff from the Public Service Commission and other interested parties. The task force may hire consultants to assist in carrying out its duties. The task force shall review issues relating to availability, adoption, and affordability of broadband services in rural areas of Nebraska. In particular, the task force shall:&para;(a) Determine how Nebraska rural areas compare to neighboring states and the rest of the nation in average download and upload speeds and in subscription rates to higher speed tiers, when available;&para;(b) Examine the role of the Nebraska Telecommunications Universal Service Fund in bringing comparable and affordable broadband services to rural residents and any effect of the fund in deterring or delaying capital formation, broadband competition, and broadband deployment;&para;(c) Review the feasibility of alternative technologies and providers in accelerating access to faster and more reliable broadband service for rural residents;&para;(d) Examine alternatives for deployment of broadband services to areas that remain unserved or underserved, such as reverse auction programs described in section 86-330, public-private partnerships, funding for competitive deployment, and other measures, and make recommendations to the Public Service Commission to encourage deployment in such areas;&para;(e) Recommend state policies to effectively utilize state universal service fund dollars to leverage federal universal service fund support and other federal funding;&para;(f) Make recommendations to the Governor and Legislature as to the most effective and efficient ways that federal broadband rural infrastructure funds received after July 1, 2018, should be expended if such funds become available; and&para;(g) Determine other issues that may be pertinent to the purpose of the task force.&para;(4) Task force members shall serve on the task force without compensation but shall be entitled to receive reimbursement for expenses incurred for such service as provided in sections 81-1174 to 81-1177.&para;(5) The task force shall meet at the call of the chairperson and shall present its findings in a report to the Executive Board of the Legislative Council no later than November 1, 2019, and by November 1 every odd-numbered year thereafter. The report shall be submitted electronically.&para;(6) For purposes of this section, broadband services means high-speed telecommunications capability at a minimum download speed of twenty-five megabits per second and a minimum upload speed of three megabits per second, and that enables users to originate and receive high-quality voice, data, and video telecommunications using any technology.","Establishes the Rural Broadband Task Force to compare Nebraska download and upload speeds with those in surrounding states, examine the role of the Universal Service Fund in expanding broadband access, review the feasibility of different technological solutions, explore alternative programs for deploying broadband, and make recommendations to the governor and Legislature. "
Nebraska,2020,"Neb. Rev. Stat. 86-5,102 et seq. ",Rights-of-way,Easements,Broadband Internet Service Infrastructure Act.,"Sections 86-5,102 to 86-5,108 shall be known and may be cited as the Broadband Internet Service Infrastructure Act. The Legislature finds and declares that (1) it is in the public interest for commercial broadband suppliers and electric utilities to enter into broadband facility agreements and (2) the use of electric utility easements and electric utility infrastructure for commercial broadband facilities pursuant to a broadband facility agreement does not diminish the value of underlying real estate...(1) An electric utility and a commercial broadband supplier may enter into a broadband facility agreement for the use of an electric utility easement or electric utility infrastructure, or both, to:&para;(a) Install, maintain, or own, or permit any commercial broadband supplier to install, maintain, or own, an attached facility for operation by a commercial broadband supplier in providing commercial broadband service; and&para;(b) Lease or otherwise provide to a commercial broadband supplier any excess capacity of attached facilities for purposes of providing commercial broadband service.&para;(2)(a) A broadband facility agreement shall contain one of the following with respect to the use of any electric utility easement:&para;(i) A statement that the electric utility has the legal right to authorize the use of the electric utility easement for commercial broadband facilities;&para;(ii) A statement that the commercial broadband supplier has compensated property owners for the use of the electric utility easement for commercial broadband facilities pursuant to subsection (5) of this section; or&para;(iii) A statement that the electric utility has given notice to property owners pursuant to subdivision (2)(b) of this section and the time for making a claim has expired.","Authorizes the use of electric utility easements or infrastructure for the installation, maintenance, or leasing of broadband facilities by commercial suppliers."
New Hampshire,2020,N.H. Rev. Stat. Ann. 33:3-g,Municipal Broadband,,Broadband Infrastructure Bonds.,"I. A municipality or communications district formed under RSA 53-G may issue bonds for the purpose of financing the development, construction, reconstruction, renovation, improvement, and acquisition of broadband infrastructure in any locations within a municipality unserved by broadband as defined in RSA 38:38, I(c). Without limiting the foregoing, broadband infrastructure may be the subject of public-private partnerships established in accordance with the provisions of RSA 33:3. &para;II. Bonds issued under this section shall be payable in annual payments so that the amount of annual payment of principal and interest in any year on account of any bond shall be not less than the amount of principal and interest payable in any subsequent year by more than 5 percent of the principal of the entire bond. The total amount of payments shall be sufficient to extinguish the entire bond at such bond's maturity. The first payment of principal on any bond shall be made no later than 5 years and the last payment not later than 30 years after the date issued. Each authorized issue of bonds shall be a separate and distinct loan. &para;III. A municipality shall not issue bonds for the purpose of financing the development, construction, reconstruction, renovation, improvement, and acquisition of broadband infrastructure in any location within a municipality unserved by broadband as defined in RSA 38:38, I(c) unless a request for information has been issued, at a minimum, to all providers serving the issuing community and such providers have been given 2 months to respond to the request. The request for information may include, but is not limited to, information identifying locations within a municipality served by broadband as defined in RSA 38:38, I(c). After completing, issuing, and receiving responses to such request for information, a municipality may issue a request for proposals for the purpose of engaging in a public-private partnership pursuant to RSA 33:3 or RSA 33-B for the deployment of broadband infrastructure, as defined in RSA 38:38, I(e), and the provision of broadband service as defined in RSA 38:38, I(f). A municipality may select a proposal based on criteria including, but not limited to, provider ability to deploy, manage, and maintain a broadband network. A municipality may determine that no provider has met the criteria included in the request for proposals and may issue bonds for purposes pursuant to RSA 33:3 and RSA 33-B, including but not limited to, open networks. If a broadband provider does not respond to a request for information pursuant to this paragraph, the locations served by that broadband provider shall be considered unserved, unless those locations are served by a broadband provider who responded to that municipality's request for information. &para;IV. Any request for information issued pursuant to this section after December 31, 2020 shall conform with a model request for information issued by the New Hampshire department of business and economic affairs.",Allows municipalities or communications districts formed under N.H. Rev. Stat. Ann. 53-G to fund the construction of broadband networks with bonds and requires that the bonds be structured to ensure that payments in any given year are not less than 5% of the principal payments in any following year. Also requires municipalities and communications districts to issue a request for information before designating an area as “unserved.”
New Hampshire,2020,N.H. Rev. Stat. Ann. 38:38 (c),Definition - Broadband,FCC,Broadband Access.,"(c) ""Broadband"" means the transmission of information, between or among points specified by the user, with or without change in the form or content of the information as sent and received, at rates of transmission defined by the Federal Communications Commission as a wireline advanced telecommunications capability as defined by section 706 of the Telecommunications Act of 1996, irrespective of the network technology used. ",Ties the definition of broadband to that used by the Federal Communications Commission.
