state,year,name,topic,subtopic,title,relevant_text,description
South Carolina,2020,S.C. Code Ann. 33-49-250,Cooperatives,Electric,Powers of cooperative.,"In addition to the powers conferred on all private corporations by Section 33-3-102, a cooperative has power: (12) to wholly or partially own, lease, maintain, construct, install, operate, and replace a broadband network directly or indirectly as provided for and subject to the limitations and requirements set forth in Article 25, Chapter 9, Title 58.","Allows electric cooperatives to directly or indirectly own, lease, maintain, construct, install, operate, and replace broadband networks. "
South Carolina,2020,S.C. Code Ann. 58-31-230,Regulatory Authority,,"Public Service Authority broadband authority.","(B) Subject to the provisions set forth in this section, the Public Service Authority shall only lease excess fiber capacity that is used for providing any broadband service to a third party through an arrangement in which the unaffiliated communications service provider provides the broadband service.&para;(C) The Public Service Authority may cause or allow unaffiliated communications service providers to lease excess fiber capacity through an arrangement in which the unaffiliated communications service provider uses such capacity to provide broadband service; provided such lease shall, subject to the requirements of Section 58-31-30(a)(13), charge rates, fees, or other charges on a nondiscriminatory basis pursuant to a written contract, at market rates and on terms and conditions that are not harmful to competition.",Allows the Public Service Authority to lease excess fiber capacity that is used for providing broadband service to a third-party unaffiliated communications service provider through an arrangement in which the third-party provides the broadband service.
South Carolina,2020,S.C. Code Ann. 58-11-800,Rights-of-way,ROW - Other,Short title; legislative findings.,"(A) This article must be known and may be cited as the ""South Carolina Small Wireless Facilities Deployment Act"".&para;(B) The General Assembly finds that:&para;(1) the deployment of small wireless facilities and other next-generation wireless and broadband network facilities is a matter of statewide concern and interest;&para;(2) wireless and broadband products and services are a significant and continually growing part of the state's economy; accordingly, encouraging the development of strong and robust wireless and broadband communications networks throughout the State is integral to the state's economic competitiveness;&para;(3) rapid deployment of small wireless facilities serves numerous important statewide goals and public policy objectives including, but not limited to, meeting growing consumer demand for wireless data, increasing competitive options for communications services available to the state's residents; promoting the ability of the state's citizens to communicate with other citizens and with their state and local governments; and promoting public safety;&para;(4) small wireless facilities, including facilities commonly referred to as small cells and distributed antenna systems, are deployed most effectively in the right of way (ROW);&para;(5) to meet the key objectives of this article, wireless providers must have access to the ROW and the ability to attach to infrastructure in the ROW to densify their networks and provide next generation wireless services;&para;(6) uniform rates and fees for the permitting and deployment of small wireless facilities in the ROW and on authority infrastructure, including poles, throughout the State is reasonable and encourages the development of robust next-generation wireless and broadband networks for the benefit of citizens throughout the State;&para;(7) the procedures, rates, and fees in this article are fair and reasonable when viewed from the perspective of the state's citizens and the state's interest in having robust, reliable, and technologically advanced wireless and broadband networks; and reflect a balancing of the interests of the wireless providers deploying new facilities and the interests of authorities in recovering their costs of managing access to the ROW and the attachment space provided on authority infrastructure in the ROW; and&para;(8) this article supersedes and preempts any enactment by an authority that contradicts, expands, contracts, or otherwise modifies the provisions of this article with respect to the regulation of the placement of small wireless facilities and of support structures and poles for small wireless facilities in the ROW provided; however, that nothing in this item limits any power granted to any authority under this article including, but not limited to, the power to enforce city-wide compliant provisions in previous enactments, so long as those provisions do not violate federal law.",Supports the deployment of small wireless facilities in the public right of way.
Tennessee,2018,Tenn. Code Ann. 13-24-401 et seq.,Wireless facilities,,"Competitive Wireless Broadband Investment, Deployment, and Safety Act of 2018","(a) Nothing in this part requires any local authority to promulgate any limits, permitting requirements, zoning requirements, approval policies, or any process to obtain permission to deploy small wireless facilities. However, any local authority that promulgates limits, permitting requirements, zoning requirements, approval policies, or processes relative to deployment of small wireless facilities shall not impose limits, requirements, policies, or processes that are:&para;(1) More restrictive than requirements, policies, or processes set forth in this part;&para;(2) In excess of that which is granted by this part; or&para;(3) Otherwise in conflict with this part.&para;(b) Any local authority limits, requirements, policies, or processes that are more restrictive, in conflict with, or in excess of that which is granted by this part are void, regardless of the date on which the requirement, policy, or process was enacted or became law.&para;(c) For colocation of small wireless facilities in the ROW that is within the jurisdiction of a local authority that does not require an application and does not require work permits for deployment of infrastructure within the ROW, an applicant shall provide notice of the colocation by providing the materials set forth in § 13-24-409(g) to the office of the county mayor and the chief administrative officer of the county highway department, if the colocation is in the unincorporated area, or the city, if the colocation is in an incorporated area...An authority shall not:&para;(1) Enter into an exclusive arrangement with any person for use of a ROW for the construction, operation, marketing, or maintenance of small wireless facilities;&para;(2) Discriminate by prohibiting an applicant from making any type of installation that is generally permitted when performed by other entities entitled to deploy infrastructure in a ROW or by imposing any maintenance or repair obligations not generally applicable to all entities entitled to deploy infrastructure in a ROW;&para;(3) Impose discriminatory prohibitions against deploying a new PSS for small wireless facilities in a ROW. Only requirements imposed generally to other entities entitled to deploy infrastructure in a ROW may be applied to prohibit an applicant's deployment of a new PSS in a ROW; or&para;(4) Except as provided in this part or otherwise specifically authorized by state law, adopt or enforce any regulations or requirements on the placement or operation of communications facilities in a ROW by a communications service provider authorized by state or local law to operate in a ROW; regulate any communications services; or impose or collect any tax, fee, or charge for the provision of communications service over the communications service provider's communications facilities in a ROW.","Prohibits local jurisdictions from regulating broadband in ways that conflict with or are more restrictive than state law and from discriminating among providers in granting access to rights-of-way for small cell facilities. Limits the fees that local governments can charge providers for permits for small wireless facilities. Regulates the permitting process for small cell facilities in state-owned rights-of-way. Defines local governments’ authority to regulate the deployment of small cell facilities; local governments may, for example, require facilities to leave rights-of-way clear for travel, comply with the Americans With Disabilities Act and with public safety measures, not obstruct use of rights-of-way by utilities, and follow an aesthetic plan for a defined area. Specifies the regulations that local governments may place on small cell deployment and sets size restrictions for small cell facilities. Requires local authorities to follow specific procedures when issuing permits for small cell facilities."
Utah,2021,Utah Code 54-8b-15 (1) (a),Definition - Broadband,Tech,Universal Public Telecommunications Service Support Fund -- Commission duties -- Charges -- Lifeline program.,"(1)	For purposes of this section:&para;(a)	""Broadband Internet access service"" means the same as that term is defined in 47 C.F.R. Sec. 8.2.","Defines “broadband” in accordance with 47 CFR 8.2: “A mass-market retail service by wire or radio that provides the capability to transmit data to and receive data from all or substantially all internet endpoints, including any capabilities that are incidental to and enable the operation of the communications service, but excluding dial-up internet access service.” This term also encompasses any service that the commission finds to be providing a service that is functionally equivalent to the service described or is used to evade the protections set forth in this part."
Vermont,2020,Vt. 30 V.S.A. 3051 et seq.,Municipal Broadband,,Communications Union Districts,"(a) Two or more towns and cities may elect to form a communications union district for the delivery of communications services and the operation of a communications plant, which district shall be a body politic and corporate.&para;(b) A town or city electing to form a district under this chapter shall submit to the eligible voters of such municipality a proposition in substantially the following form: ""Shall the Town of ______ enter into a communications union district to be known as ______, under the provisions of 30 V.S.A. chapter 82?"" at an annual or special meeting of such town or city.&para;(c) Additional towns or cities may be admitted to the district in the manner provided in section 3082 of this chapter...(a) In addition to the powers enumerated in 24 V.S.A. § 4866, and, subject to the limitations and restrictions set forth in section 3056 of this chapter, a district created under this chapter shall have the power to:&para;(1) operate, cause to be operated, or contract for the construction, ownership, management, financing, and operation of a communications plant for the delivery of communications services, as provided in 24 V.S.A. chapter 54, and all enactments supplementary and amendatory thereto;&para;(2) purchase, sell, lease, own, acquire, convey, mortgage, improve, and use real and personal property in connection with its purpose;&para;(3) hire and fix the compensation and terms of employment of employees;&para;(4) sue and be sued;&para;(5) enter into contracts for any term or duration;&para;(6) contract with architects, engineers, financial and legal consultants, and others for professional services;&para;(7) contract with individuals, corporations, associations, authorities, and agencies for services and property, including the assumption of the liabilities and assets thereof;&para;(8) provide communications services for its district members, including the residential and business locations located therein; and also provide communications services for such other residential and business locations as its facilities and obligations may allow, provided such other locations are in a municipality that is contiguous with the town limits of a district member, and further provided such other locations do not have access to Internet service capable of speeds that meet or exceed the current speed requirements for funding eligibility under the Connectivity Initiative, section 7515b of this title.&para;(9) contract with the State of Vermont, the United States of America, or any subdivision or agency thereof for services, assistance, and joint ventures;&para;(10) contract with any municipality for the services of any officers or employees of that municipality useful to it;&para;(11) promote cooperative arrangements and coordinated action among its members and other public and private entities;&para;(12) make recommendations for review and action to its members and other public agencies which perform functions within the region in which its members are located;&para;(13) exercise any other powers which are necessary or desirable for dealing with communications matters of mutual concern and that are exercised or are capable of exercise by any of its members;&para;(14) enter into financing agreements as provided by 24 V.S.A. § 1789 and chapter 53, subchapter 2, or other provisions of law authorizing the pledge of net revenue, or alternative means of financing capital improvements and operations;&para;(15) establish a budget to provide for the funding thereof out of general revenue of the district;&para;(16) appropriate and expend monies;&para;(17) establish sinking and reserve funds for retiring and securing its obligations;&para;(18) establish capital reserve funds and make appropriations thereto for communications plant improvements and the financing thereof;&para;(19) enact and enforce any and all necessary or desirable bylaws for the orderly conduct of its affairs for carrying out its communications purpose and for protection of its communications property;&para;(20) solicit, accept, and administer gifts, grants, and bequests in trust or otherwise for its purpose;&para;(21) exercise all powers incident to a public corporation;&para;(22) adopt a name under which it shall be known and shall conduct business; and&para;(23) establish an effective date of its creation.","Allows two or more towns and cities to form a communications union district for the delivery of communications services, including broadband. Grants such districts the right to generate revenue, appropriate funding, and enter into financing agreements as necessary to provide communications services for its members."
Virginia,2020,Va. Code 55.1-306 et seq.,Rights-of-way,Easements,Utility easements.,"A. For the purposes of this section, ""utility services"" means any products, services, and equipment related to energy, broadband and other communications services, water, and sewerage.&para;B. Where an easement, whether appurtenant or gross, is expressly granted by an instrument recorded on or after July 1, 2006, that imposes on a servient tract of land a covenant (i) to provide an easement in the future for the benefit of utility services; (ii) to relocate, construct, or maintain facilities owned by an entity that provides utility services; or (iii) to pay the cost of such relocation, construction, or maintenance, such covenant shall be deemed for all purposes to touch and concern the servient tract, to run with the servient tract, its successors, and assigns for the benefit of the entity providing utility services, its successors, and assigns...B. It is the policy of the Commonwealth that:&para;1. Easements for the location and use of electric and communications facilities may be used to provide or expand broadband or other communications services;&para;2. The use of easements, appurtenant or gross, to provide or expand broadband or other communications services is in the public interest;&para;3. The installation, replacement, or use of public utility conduit, including the costs of installation, replacement, or use of conduit of a sufficient size to accommodate the installation of infrastructure to provide or expand broadband or other communications services, is in the public interest.",Authorizes the use of easements for electric and communications facilities that will be used to provide broadband services.
Virginia,2020,Va. Code 2.2-1151.1,Permitting,,Conveyances of right-of-way usage to certain nonpublic service companies by the Department of Transportation.,"A. As used in this section:""Department"" means the Virginia Department of Transportation.""Developer"" means a person who undertakes to develop real estate.""Social welfare organization"" means an organization as defined in § 501(c)(4) of the Internal Revenue Code.&para;B. No land use permit shall be issued by the Department to any company other than a public service company as defined in § 56-76, a company owning or operating an interstate natural gas pipeline, a social welfare organization operating a wholesale open-access fiber network, or a franchised cable television systems operator owning or operating a utility line as defined in § 56-265.15, unless such company, organization, or operator has (i) registered as an operator with the appropriate notification center as defined by § 56-265.15 and (ii) notified the commercial and residential developer, owner of commercial, multifamily, or residential real estate, or local government entities with a property interest in any parcel of land located adjacent to the property over which the land use is being requested that application for the permit has been made. Any permit application approved by the Department shall include an affidavit indicating compliance with the registration and notification requirements provided by this subsection.&para;C. The provisions of subsection B shall not apply to a land use permit issued by the Department to (i) a person providing utility service solely for his own agricultural or residential use, provided that the utilities are located on property owned by the person, or (ii) the owner of a private residence or business for water or sewer service to cross the Department's right-of-way when no viable alternative exists to provide potable water or to transfer sewer effluent to a qualified drain field. In the case of any application for a land use permit under this subsection, the utilities shall be marked in accord with requirements established by the Department.&para;D. No performance surety held by the Department in association with a land use permit issued to a company pursuant to subsection B to perform work within the Department's right-of-way shall be released until such time as all claims against the company associated with the work have been resolved, provided a claimant has notified the Department of a claim against such company within 30 days after completion of the work. A claimant shall have no more than one year after the notification is received by the Department to complete any action against the company associated with the work for which the claim has been made. After the expiration of the one-year period, the Department may release the performance surety.&para;E. Nothing in this section shall be construed or interpreted to create a cause of action or administrative claim against the Department.","States that the Virginia Department of Transportation can issue land use permits to public service companies, firms that own or operate interstate natural gas pipelines, social welfare organizations that operate wholesale open-access fiber networks, and franchised cable television systems operators that own or operate utility lines."
Virginia,2020,Va. Code 56-585.1:9,Service Provision - Other,,Pilot program for broadband capacity to unserved areas of the Commonwealth.,"A. The Commission shall establish pilot programs under which each Phase I Utility and each Phase II Utility, as such terms are defined in subdivision A 1 of § 56-585.1, may submit one or more petitions to provide or make available broadband capacity to nongovernmental Internet service providers in areas of the Commonwealth unserved by broadband. Any such petitions that a Phase I Utility submits shall not exceed $60 million in costs annually. Any such petitions that a Phase II Utility submits shall not exceed $60 million in costs annually. The provision of such broadband capacity to nongovernmental Internet service providers in areas of the Commonwealth unserved by broadband pursuant to this section is in the public interest.","Allows electric utilities to petition the Corporation Commission for permission to lease excess capacity on their fiber-optic cables to nongovernmental internet service providers in unserved areas. The costs of providing service is recoverable from electric rate payers. Utilities are allowed to own infrastructure and lease it out to internet service providers, and to install infrastructure outside of their service territories to connect providers to their networks. Specifies the application process and states that utilities and internet service providers are still responsible for obtaining all necessary rights-of-way and easements."
